{
  "run_id": "2026-02-15T123900Z",
  "scope": {
    "level": "epic",
    "items": [
      { "id": "A-007", "title": "Aggregate root architecture test (deferred from Epic 5)" },
      { "id": "7.1", "title": "Health Check Endpoints" },
      { "id": "7.2", "title": "Azure Infrastructure as Code" },
      { "id": "7.3", "title": "CI/CD Pipeline with Auto-Migration" },
      { "id": "7.4", "title": "Staging Environment" }
    ],
    "git": {
      "base": "3414c38",
      "head": "edea2da"
    }
  },
  "summary": {
    "wins": [
      "Complete Azure deployment infrastructure delivered: Bicep IaC (parameterized SKUs, Key Vault, Blob Storage), CI/CD pipeline with OIDC federated credentials, staging/production environment isolation, health check endpoints — all 4 stories done in ~50 minutes",
      "Zero new test failures or regressions introduced — 311 frontend tests pass, 114 domain tests pass, zero tsc errors, zero ESLint warnings. Pre-epic gate fixed 22 ESLint errors (bf38a64)",
      "Critical auto-migration bug (C-1) caught during review and fixed before merge — Database:AutoMigrate config guard prevents Production-env test breakage (62b2ee8)",
      "Deferred A-007 (aggregate root architecture test) completed with rigorous enforcement — AggregateRootArchitectureTests.cs validates DbContext exposes no DbSets for owned entities (4adb83c)",
      "Previous retro experiments E-011 (quality signals checklist) and E-012 (zero-error pre-epic gate) both validated PASS — all quality signals captured, zero pre-existing tsc errors"
    ],
    "problems": [
      "DEMO BLOCKED for 3rd consecutive epic (4, 5, 7) — 0/25 ACs verified live. Epic 7 delivered CLOUD deployment infrastructure (Azure Bicep, GitHub Actions) but NOT LOCAL development infrastructure. User frustration: 'I am very annoyed that we still can't do the demo because there are infrastructure still missing.' Scope/expectations mismatch is the root cause.",
      "10 pre-existing backend test failures persist uninvestigated for 6+ epics — blob storage mocking (5 tests), stale candidate filtering (3 tests), validator architecture (1 test), email validation (1 test). These normalize failure and mask new regressions.",
      "Code coverage collected by CI (ci.yml:17) but NEVER captured in retro evidence — 6th consecutive epic without coverage data. A-004 from previous retro: CI side was applied but reporting gap persists.",
      "Fix cycle rate increased to 75% (3 of 4 stories required fixes) vs 50% in Epic 5. Story 7.3 had a CRITICAL finding (C-1: auto-migration breaks all Production-env tests). Pre-implementation architectural risk assessment is missing.",
      "Dev Agent Record section empty in ALL 4 stories (7.1-7.4) — 4th consecutive occurrence of systemic process gap. Review Agent approved with Minor severity only despite team-workflow.md requiring non-empty sections.",
      "CD pipeline duplicates CI: rebuilds, retests (including Testcontainers), then deploys. Wastes GitHub Actions minutes and creates deployment risk from Docker infrastructure dependencies.",
      "Evidence bundle error: A-005 and A-006 incorrectly flagged as NOT APPLIED — both were applied in commit fccb045 (Epic 5 retro self-healing). Evidence assembly checked Epic 7 commits only, missing pre-epic retro commits."
    ],
    "root_cause_hypotheses": [
      "Scope/expectations mismatch: Epic 7 was scoped as CLOUD deployment automation (Azure Bicep, azd, GitHub Actions) but the user expected it to resolve LOCAL development infrastructure blockers. The epic title 'Deployment & Infrastructure Automation' was ambiguous.",
      "Evidence assembly gap: Phase 1 evidence checked for file modifications within the epic commit range (bf38a64..edea2da) but did not check commits between the previous retro and epic start. This caused false NOT APPLIED flags for A-005 and A-006.",
      "Test failure normalization: 10 failures have been reported as 'pre-existing' for 6+ epics with no escalation mechanism. The process lacks an auto-escalation rule for long-lived test failures (similar to the existing rule for carried retro actions).",
      "Dev Agent Record is a process gap, not a code gap: anti-pattern hooks catch code patterns but cannot enforce process compliance (filling out sections in implementation docs). Needs a pre-review gate."
    ],
    "missing_evidence": [
      "Code coverage percentages — CI collects (ci.yml:17) but data not extracted to retro evidence",
      "Functional test execution — Testcontainers tests BLOCKED across all epics (no Docker/SQL Server locally)",
      "Deployment smoke test results — Bicep templates and CD pipeline never executed against real Azure resources",
      "Configuration schema validation — no evidence that Database:AutoMigrate, connection strings, etc. are validated at startup",
      "Architecture shard read tracking — no evidence of which shards were read before implementation"
    ]
  },
  "actions": [
    {
      "id": "A-001",
      "title": "Investigate and fix 10 pre-existing backend test failures",
      "type": "quality_gate_gap",
      "priority": "P0",
      "owner_persona": "QA",
      "rationale": "10 backend unit tests have failed for 6+ epics without investigation. Failures span blob storage mocking (5 tests), stale candidate filtering (3 tests), validator architecture (1 test), and email validation (1 test). Tolerating persistent failures normalizes failure and masks new regressions. CI red-green feedback loop is meaningless with a baseline of 10 known failures.",
      "evidence_refs": [
        "context.md section 3: 'Backend unit tests: 227 passed, 10 FAILED (all pre-existing)'",
        "context.md section 11: full list of 10 failing tests with categories",
        "DEL-001, QA-001, ARCH-003: 3 lenses flagged this as P0"
      ],
      "acceptance_criteria": [
        "All 10 pre-existing test failures investigated: each categorized as infrastructure fix, actual bug, or obsolete test",
        "Zero backend unit test failures — dotnet test returns 237/237 passed",
        "Root cause documented per test in commit message",
        "CI enforces zero unexpected test failures: dotnet test returns exit code 0"
      ],
      "automation_hints": [
        "Run each failing test individually with verbose output to capture exact failure reason",
        "For blob storage tests: verify IBlobStorageService mock configuration matches current interface",
        "For stale candidate tests: check if Epic 5 overview changes modified underlying query logic",
        "For validator test: check AllRequestTypes_ShouldHaveValidator_UnlessExempt exempt list",
        "For email validation: verify max length matches current validator rules"
      ],
      "files_to_touch": [
        "api/tests/Application.UnitTests/Architecture/ValidatorArchitectureTests.cs",
        "api/tests/Application.UnitTests/Features/Candidates/Commands/AssignDocument/AssignDocumentCommandHandlerTests.cs",
        "api/tests/Application.UnitTests/Features/Overview/Queries/GetRecruitmentOverviewTests.cs",
        "api/tests/Application.UnitTests/Services/BlobOwnershipTests.cs"
      ],
      "risk_if_ignored": "Test suite credibility erodes. Real regressions masked by noise. Production bugs in blob storage, validation, or candidate filtering ship undetected."
    },
    {
      "id": "A-002",
      "title": "Capture code coverage data in retro evidence (CI already collects)",
      "type": "instrumentation_gap",
      "priority": "P0",
      "owner_persona": "Delivery",
      "rationale": "A-004 from Epic 5 retro (P1) was carried forward as NOT APPLIED for 6 consecutive epics. CI pipeline already collects coverage (ci.yml:17 --collect:'XPlat Code Coverage') but the data is never extracted or reported in retro evidence. The COLLECTION is working — the REPORTING gap is the real issue. Auto-escalates to P0 per process rules.",
      "evidence_refs": [
        "context.md section 1b: 'A-004 | Verify code coverage CI status | P1 | NOT APPLIED'",
        "ci.yml:17: 'dotnet test api/api.slnx --no-build --collect:\"XPlat Code Coverage\"' — CI DOES collect",
        "context.md section 3: 'Code Coverage: Not measured' — retro evidence doesn't capture CI output",
        "DEL-002, QA-002, ARCH-004, SRE-007: 4 lenses flagged this"
      ],
      "acceptance_criteria": [
        "team-workflow.md Phase 1 evidence assembly includes step to extract coverage % from CI output",
        "Retro evidence context.md includes 'Code Coverage' section with backend line coverage %",
        "Frontend coverage: add vitest --coverage to retro evidence collection",
        "Next retro reports actual coverage percentages, not 'Not measured'"
      ],
      "automation_hints": [
        "Backend: CI already generates coverage — extract line-rate from coverage.cobertura.xml",
        "Frontend: run 'npx vitest run --coverage' during evidence collection",
        "Add coverage to team-workflow.md Phase 1 quality signals checklist as mandatory",
        "Upload CI coverage report as GitHub Actions artifact for retro access"
      ],
      "files_to_touch": [
        ".claude/process/team-workflow.md",
        ".github/workflows/ci.yml"
      ],
      "risk_if_ignored": "7th consecutive epic without coverage data. Untested code paths accumulate invisibly. P0 action ignored signals complete process breakdown."
    },
    {
      "id": "A-003",
      "title": "Resolve local dev environment for demos and testing",
      "type": "quality_gate_gap",
      "priority": "P0",
      "owner_persona": "SRE",
      "rationale": "Demo BLOCKED for 3rd consecutive epic (4, 5, 7). Code is merged without running the application once. Epic 7 addressed CLOUD deployment but not LOCAL runtime. User expected Epic 7 to fix this. Docker Compose exists but Docker is not installed. Native mode fails (LocalDB not supported on Linux). This is the #1 user frustration.",
      "evidence_refs": [